https://farm5.staticflickr.com/4701/25986299398_867bf00a74_b.jpg,2018:01:22,10:08:33,60.161095,24.889247,"car, transportation system, street, bus, vehicle, traffic, road, city, travel, no person",2.0566,2.1226,happy
https://farm5.staticflickr.com/4708/38938886155_53d35098a5_b.jpg,2018:01:22,07:16:10,60.202468,24.957826,"desktop, cereal, no person, many, seed, bean, texture, crop, food, legume",2.0037,1.5317,serene
https://farm5.staticflickr.com/4628/39349156424_05aa3af311_b.jpg,2018:01:22,12:36:16,60.228300,25.145302,"snow, winter, wood, cold, frost, tree, landscape, weather, season, frozen",2.0545,1.6609,serene
https://farm5.staticflickr.com/4623/38935497215_d29c1ee96f_b.jpg,2018:01:22,12:25:31,60.245094,24.751838,"no person, monochrome, ball, sphere, desktop, shining, abstract, one, glisten, pattern",1.9472,1.7447,sad
https://farm5.staticflickr.com/4760/39149794194_dd6f66f903_b.jpg,2018:01:21,19:39:32,60.114733,24.695377,"landscape, light, tree, sunset, dawn, evening, no person, street, dusk, sky",2.2893,1.4805,relaxed
https://farm5.staticflickr.com/4710/25986712128_ce1481375d_b.jpg,2018:01:21,19:00:37,60.112552,24.704132,"winter, tree, no person, landscape, wood, snow, road, light, outdoors, nature",2.244,1.6244,serene
https://farm5.staticflickr.com/4708/39988212231_77169e20fc_b.jpg,2018:01:23,22:49:38,60.322222,25.080555,"no person, food, health, medicine, ingredients, wood, still life, indoors, cooking, rice",2.1136,1.7545,contented