39878512891_787e04bb5f_b.jpg,2018:01:24,16:09:47,48.102652,11.457030,"fall, leaf, no person, nature, tree, wood, maple, dry, flora, outdoors",2.1612,1.6348,serene
39882806042_5015b46bd2_b.jpg,2018:01:26,17:14:27,48.137247,11.575091,"architecture, city, travel, building, tourism, town, tourist, daylight, street, outdoors",2.1702,1.9094,contented
39910162852_b140f9d7b3_b.jpg,2018:01:27,20:46:31,48.113511,11.739544,"tunnel, hallway, no person, subway system, museum, light, architecture, people, arch, indoors",1.7847,1.7552,miserable
39917604882_e94006c804_b.jpg,2018:01:26,15:44:02,48.110955,11.649630,"vehicle, car, transportation system, no person, travel, outdoors, bus, road, truck, traffic",2.0512,2.2361,happy
26016206278_25be9f6d6f_b.jpg,2018:01:25,11:47:45,48.181117,11.551136,"no person, architecture, light, art, modern, sunset, city, contemporary, sun, minimalism",2.0976,1.7865,contented
28026354489_8c439372c6_b.jpg,2018:01:20,18:16:50,48.176984,11.556458,"car, vehicle, automotive, exhibition, transportation system, drive, no person, classic, sedan, race",2.2058,2.2211,happy
28115288639_aaeacb4db5_b.jpg,2018:01:24,13:36:47,48.106086,11.553283,"water, river, beach, landscape, bridge, storm, sunset, travel, light, sea",2.2442,1.887,contented
39048566454_52b04c63e7_b.jpg,2018:01:18,10:26:00,48.123003,11.513178,"no person, tree, landscape, leaf, nature, garden, park, travel, shrub, stone",2.2108,1.7241,serene
39807665271_857c955b7b_b.jpg,2018:01:19,15:19:15,48.136409,11.577529,"architecture, building, no person, travel, city, sky, outdoors, church, old, tower",2.0556,1.8242,contented
39883921372_6968efbdbe_b.jpg,2018:01:25,20:55:20,48.184405,11.556719,"airport, architecture, travel, no person, indoors, business, modern, subway system, lobby, escalator",1.8445,1.9486,miserable
39016617315_349a58b767_b.jpg,2018:01:26,17:27:38,48.136872,11.575277,"city, cityscape, architecture, travel, roof, skyline, panorama, no person, town, urban",2.0952,1.9889,contented
39076624535_8c529b0881_b.jpg,2017:11:19,12:37:51,48.135605,11.573108,"group, people, group together, portrait, many, music, four, education, adult, child",2.1564,1.969,contented
39840115952_4409671da2_b.jpg,2018:01:24,13:17:43,48.140496,11.547553,"bridge, architecture, street, road, city, no person, building, light, transportation system, urban",1.9349,1.7481,sad
39920100332_390571bb27_b.jpg,2018:01:28,17:46:16,48.145499,11.586558,"swan, bird, lake, pool, water, waterfowl, no person, duck, wildlife, poultry",2.2662,1.8403,contented
39272400984_301b569715_b.jpg,2017:12:31,21:11:15,48.136258,11.576510,"no person, tower, architecture, city, travel, steel, sky, dark, light, tallest",2.0311,1.8347,contented
27936492289_3a1ee7a8ce_b.jpg,2018:01:15,12:16:18,48.137269,11.575622,"tunnel, subway system, abstract, modern, design, inside, architecture, perspective, light, indoors",1.8288,1.6976,sad
39204867714_fa778c51c0_b.jpg,2018:01:26,17:32:05,48.136555,11.575611,"city, architecture, roof, cityscape, travel, panorama, skyline, town, no person, aerial",2.1543,2.0867,happy
24982795847_a6a08c4d7d_b.jpg,2018:01:23,12:12:42,48.132348,11.543251,"people, one, portrait, adult, park, outdoors, winter, daylight, man, no person",2.1204,1.8879,contented
38901454354_6b921252e1_b.jpg,2018:01:09,15:22:32,48.178658,11.407341,"house, architecture, street, town, building, city, travel, home, outdoors, family",2.2007,1.8009,contented
39076624555_f66b2b15e4_b.jpg,2017:11:19,12:18:37,48.135063,11.573372,"sculpture, nude, people, art, statue, adult, man, one, museum, ancient",2.0122,1.8559,contented
39809504542_2551f73ff3_b.jpg,2017:04:20,10:17:24,48.137500,11.580000,"indoors, seat, furniture, room, no person, inside, table, interior design, church, architecture",1.9139,1.4809,depressed
25044058387_9290cf8122_b.jpg,2018:01:26,19:41:01,48.136836,11.576822,"people, step, light, indoors, street, city, subway system, airport, business, window",1.9423,1.8435,miserable
26042792178_e7edcbb21b_b.jpg,2018:01:26,20:18:11,48.152616,11.581930,"architecture, city, travel, street, building, no person, outdoors, monument, museum, sculpture",1.9949,1.8385,miserable
39017121315_270ca69b58_b.jpg,2018:01:26,22:52:01,48.138561,11.569994,"city, people, architecture, building, street, group, tourist, many, travel, tourism",2.0905,2.0115,happy
39638215071_b666c72954_b.jpg,2018:01:11,21:11:53,48.136333,11.573075,"paper, design, decoration, desktop, illustration, picture frame, text, vector, bill, wall",1.7184,1.5421,sad
28135745749_438ac0e43f_b.jpg,2018:01:26,23:04:27,48.135669,11.567955,"city, no person, street, architecture, building, urban, travel, business, window, outdoors",1.9988,1.8924,miserable
39841684901_44f36d0675_b.jpg,2017:04:21,09:49:24,48.138611,11.574444,"furniture, table, seat, chair, no person, room, restaurant, travel, architecture, indoors",2.039,1.7178,serene
39944477992_ace95f4c28_b.jpg,2018:01:30,00:26:05,48.137582,11.573474,"people, wear, group, outfit, music, public show, costume, festival, celebration, performance",2.2575,2.2039,happy
39974270931_2a32f44f20_b.jpg,2018:01:29,18:01:33,48.126705,11.576613,"no person, water, architecture, river, city, sunset, travel, dusk, evening, dawn",2.2565,1.8698,contented
25044033727_3620a81113_b.jpg,2018:01:26,17:59:28,48.137177,11.575677,"architecture, travel, building, city, no person, tower, outdoors, old, sky, tourism",2.0874,1.8706,contented
28136053299_68a29908d6_b.jpg,2018:01:25,17:45:25,48.177769,11.555247,"car, vehicle, transportation system, drive, automotive, chrome, wheel, no person, travel, exhibition",2.2761,2.2687,elated
25996453328_4fe32affbc_b.jpg,2018:01:24,09:00:29,48.138888,11.567777,"street, people, city, pavement, urban, woman, shopping, architecture, building, road",2.0504,1.8442,contented
39876637291_edb6cbce98_b.jpg,2018:01:16,16:24:32,48.147572,11.572153,"no person, aircraft, business, travel, outdoors, vehicle, airplane, airport, one, flight",1.8872,2.0663,upset
39016582145_ee59f9b8c9_b.jpg,2018:01:26,17:31:54,48.136494,11.575733,"city, no person, architecture, travel, roof, cityscape, town, skyline, outdoors, panorama",2.1543,2.0867,happy
39162636314_046ee1e1e5_b.jpg,2018:01:10,14:48:21,48.137539,11.575459,"architecture, no person, sky, travel, outdoors, tower, building, Gothic, old, ancient",2.0323,1.7461,serene
39810002542_de0a0dfb8c_b.jpg,2018:01:21,11:26:15,48.218768,11.624715,"stadium, football, soccer, competition, bleachers, game, grandstand, venue, sports fan, sport",2.2375,2.4063,elated
39915872851_d8e696cf85_b.jpg,2018:01:26,21:28:07,48.142616,11.577380,"street, architecture, city, travel, road, building, house, no person, outdoors, urban",2.0202,1.8299,contented
25974133928_8018d847c2_b.jpg,2017:12:24,12:47:47,48.136129,11.573807,"city, street, people, group, tourist, travel, tourism, building, architecture, urban",2.0682,1.956,contented
26052803698_53af10e474_b.jpg,2018:01:26,15:31:45,48.103522,11.549686,"swan, bird, lake, goose, poultry, neck, pool, duck, waterfowl, nature",2.1083,1.7648,contented
28136233909_c27c833c1f_b.jpg,2018:01:25,17:55:49,48.177274,11.556577,"car, exhibition, vehicle, transportation system, automotive, fast, competition, International, race, action",2.2041,2.3653,elated
39016831565_47d5dff56d_b.jpg,2018:01:26,18:30:44,48.138572,11.573169,"no person, architecture, travel, religion, church, building, city, daylight, cathedral, indoors",2.1231,1.9964,contented
25817250438_d88b41343b_b.jpg,2018:01:14,14:12:05,48.147536,11.573577,"desktop, no person, pattern, abstract, design, texture, color, bamboo, reflection, bright",1.9823,1.6703,sad
38901441974_85f3817d29_b.jpg,2018:01:09,15:20:41,48.178716,11.407177,"architecture, travel, building, house, city, old, tourism, street, water, urban",2.018,1.7775,contented
39615937542_e58561da32_b.jpg,2018:01:09,16:47:00,48.174972,11.437844,"sky, sunset, landscape, dawn, silhouette, electricity, sun, energy, no person, light",2.2268,1.9073,contented
39785358692_198bdbe034_b.jpg,2018:01:21,13:49:31,48.129844,11.606458,"no person, fence, building, architecture, street, city, outdoors, urban, travel, jail",1.8714,1.9552,miserable
39949944382_14a3fef909_b.jpg,2018:01:26,17:22:46,48.131718,11.589996,"tree, no person, architecture, city, sky, light, building, fall, travel, landscape",2.1532,1.9291,contented
25080899717_6a33a6732f_b.jpg,2018:01:28,17:30:34,48.145091,11.587106,"no person, bird, goose, wildlife, nature, water, waterfowl, pool, duck, lake",2.4374,1.8463,contented
26042434698_74d3240d0e_b.jpg,2018:01:26,17:30:01,48.136694,11.575597,"architecture, no person, travel, city, church, cathedral, tower, building, sky, old",2.0556,1.8242,contented
38894064055_e53524a32c_b.jpg,2018:01:01,23:28:59,48.139883,11.578019,"no person, architecture, travel, city, building, sculpture, outdoors, art, statue, castle",2.131,2.0369,happy
28135281309_ff8f54188f_b.jpg,2018:01:26,17:21:02,48.136469,11.575475,"no person, architecture, travel, wall, old, building, step, ancient, indoors, tunnel",1.8611,1.8286,miserable
39583741482_4fce32c987_b.jpg,2017:07:18,23:49:35,48.138316,11.582325,"church, architecture, ceiling, indoors, column, arch, religion, travel, inside, cathedral",1.8662,1.7167,sad
39883573472_52c81daae7_b.jpg,2018:01:25,16:51:55,48.140455,11.559477,"indoors, travel, business, airport, city, reflection, architecture, transportation system, building, subway system",1.9905,2.0872,upset
39683525801_c260a6f79a_b.jpg,2016:07:05,17:44:36,48.138631,11.573131,"architecture, church, religion, sky, travel, building, cathedral, old, dome, tower",1.9878,1.7175,sad
25748840228_f3dc5ddfe9_b.jpg,2017:12:30,14:08:54,48.188611,11.613055,"transportation system, car, traffic, vehicle, road, no person, fast, asphalt, travel, blur",2.1383,2.3064,elated
26004640058_2f4d1e5e5e_b.jpg,2018:01:24,15:51:14,48.101961,11.461252,"no person, flower, leaf, blur, nature, dof, light, dawn, outdoors, flora",2.3174,1.4284,relaxed
26042435028_fe91562681_b.jpg,2018:01:26,17:29:55,48.136697,11.575600,"no person, city, travel, architecture, sunset, skyline, sky, cityscape, water, cathedral",2.4532,2.0746,happy
39653439642_9af92d617b_b.jpg,2017:11:19,10:45:34,48.177041,11.556823,"travel, no person, architecture, transportation system, car, modern, sky, city, business, street",2.1222,1.9544,contented
39844698891_8e3bfc45d2_b.jpg,2017:12:06,15:31:26,48.130809,11.572369,"architecture, no person, travel, house, window, city, building, outdoors, street, urban",2.0702,1.8299,contented
25849160048_933dc606f6_b.jpg,2018:01:13,12:38:18,48.141736,11.602916,"flame, welder, torch, metalwork, flash, people, artisan, festival, smoke, light",1.8167,1.9688,miserable
26041985668_e9b622c3b1_b.jpg,2018:01:26,15:38:19,48.109386,11.648858,"window, door, room, light, house, no person, architecture, doorway, reflection, indoors",1.9609,1.5854,sad
39873010852_de0080eefb_b.jpg,2016:07:06,13:38:21,48.136959,11.576789,"people, art, doll, Halloween, man, monochrome, skull, toy, retro, sculpture",2.2482,1.8574,contented
28135579189_771215b661_b.jpg,2018:01:26,20:20:43,48.152811,11.582213,"architecture, city, travel, street, no person, building, road, outdoors, monument, sculpture",2.0574,1.8455,contented
38881065065_84c9fa9991_b.jpg,2018:01:17,12:05:11,48.100769,11.641783,"palm, tropical, summer, desktop, beach, tree, vacation, exotic, relaxation, coconut",2.693,1.6881,serene
39087343835_7156f566ce_b.jpg,2018:01:22,18:00:00,48.154090,11.623685,"business, signal, no person, outdoors, travel, architecture, street, soccer, light, building",1.8796,1.8693,miserable
39205750264_9c892877b1_b.jpg,2018:01:25,17:35:36,48.139761,11.559638,"travel, train, subway system, indoors, transportation system, public, railway, business, inside, city",1.9708,2.1031,upset
24464133187_0d04609313_b.jpg,2017:11:03,13:03:23,48.140472,11.564697,"architecture, decoration, travel, building, design, art, step, no person, religion, arch",1.9815,1.9219,miserable
24522472077_f1ba447fb9_b.jpg,2017:12:23,11:02:33,48.141048,11.561104,"train, railway, tramway, tram, transportation system, locomotive, travel, urban, street, city",2.0912,2.0571,happy
24572908917_b6ab7bb75e_b.jpg,2017:12:31,19:01:07,48.195975,11.641580,"light, landscape, people, festival, action, evening, flame, music, concert, city",2.155,2.074,happy
25484574728_37feb6eb59_b.jpg,2017:12:24,17:02:32,48.116555,11.577980,"people, group, adult, woman, furniture, wear, room, many, man, vehicle",2.1147,1.995,contented
39579715831_f698f8c9eb_b.jpg,2018:01:08,18:28:09,48.133415,11.704720,"monochrome, architecture, no person, modern, urban, city, street, concrete, art, bridge",1.9071,1.6912,sad
25523647198_ed5dc1b512_b.jpg,2017:12:27,15:44:24,48.133888,11.573624,"desktop, texture, abstract, design, pattern, wall, architecture, fabric, window, color",1.9001,1.563,sad
27536260939_f477952697_b.jpg,2017:12:05,15:06:20,48.137604,11.575180,"architecture, no person, travel, city, tower, church, outdoors, sky, building, old",2.0556,1.8242,contented
27716980329_b3bc2f2a1a_b.jpg,2018:01:03,12:39:16,48.130216,11.582733,"step, no person, architecture, steel, indoors, handrail, spiral, ladder, contemporary, iron",1.7201,1.6603,sad
39353192611_1c968f022b_b.jpg,2017:12:24,15:30:55,48.135350,11.588072,"river, reflection, water, no person, lake, tree, bridge, dawn, architecture, sunset",2.2476,1.7144,serene
39477982771_740fd9dabe_b.jpg,2017:12:29,08:31:33,48.149988,11.462180,"train, railway, locomotive, transportation system, railroad track, subway system, station, train station, steel, urban",1.924,1.8789,miserable
24714221747_9eaa9d7513_b.jpg,2018:01:08,20:24:33,48.128333,11.579444,"tunnel, architecture, subway system, light, no person, indoors, travel, wall, arch, building",1.8596,1.7825,miserable
25527419468_7530af1ace_b.jpg,2017:11:01,15:24:42,48.142938,11.574812,"sweet, fruit, food, sugar, delicious, cake, no person, strawberry, candy, confection",2.4702,1.5008,serene
38457330165_532f72b9a2_b.jpg,2017:12:27,15:57:04,48.136801,11.578407,"no person, outdoors, architecture, travel, indoors, door, business, horizontal, fair weather, transportation system",2.0671,2.0181,happy
38621669295_4849991e19_b.jpg,2018:01:04,07:44:53,48.224500,11.616152,"car, transportation system, vehicle, traffic, road, hurry, light, blur, race, auto racing",2.0117,2.1287,happy
39431782721_0ffd3c8a67_b.jpg,2017:12:31,14:03:04,48.247311,11.577570,"landscape, fall, tree, no person, nature, river, park, grass, water, wood",2.1913,1.6596,serene
24507585747_516d72413d_b.jpg,2017:12:29,15:27:04,48.137468,11.575587,"architecture, travel, building, no person, city, church, tower, old, religion, sky",2.0495,1.8216,contented
25577037048_5e45b50109_b.jpg,2017:12:26,10:54:09,48.174569,11.551213,"travel, public, street, no person, traffic, city, road, stop moving, urban, flag",1.8175,1.8673,miserable
25673491788_07e121fc29_b.jpg,2018:01:03,11:30:02,48.140947,11.578549,"indoors, inside, no person, ceiling, travel, church, architecture, arch, religion, building",1.89,1.776,miserable
39464408262_395a026395_b.jpg,2018:01:03,14:31:42,48.136247,11.578322,"architecture, building, city, no person, house, urban, travel, street, outdoors, town",2.0411,1.8354,contented
25502913098_3250346147_b.jpg,2017:12:29,15:30:31,48.137239,11.576081,"people, one, adult, man, street, woman, two, wear, group, monochrome",2.1336,1.881,contented
38598052504_2879a7cc9e_b.jpg,2017:12:01,13:21:08,48.132334,11.543498,"winter, snow, no person, one, cold, tree, park, nature, outdoors, wood",2.2037,1.6557,serene
25443772088_f9650e821c_b.jpg,2017:12:26,16:58:46,48.132484,11.551029,"abstract, insubstantial, desktop, color, background, art, blur, sky, wallpaper, pattern",2.128,1.6,serene
27576869949_375889638a_b.jpg,2017:12:24,16:38:27,48.125677,11.582675,"city, building, winter, street, road, tree, landscape, no person, architecture, snow",2.1211,1.7438,serene
25491096118_8b18b3f5c9_b.jpg,2017:12:24,14:44:59,48.125338,11.572152,"water, architecture, river, no person, landscape, house, winter, building, city, reflection",2.0989,1.8146,contented
27550793589_e8e68db194_b.jpg,2017:12:26,13:14:49,48.106169,11.553319,"landscape, tree, lake, no person, nature, water, winter, wood, river, outdoors",2.2928,1.7357,serene
38645643444_4691205a28_b.jpg,2017:12:24,17:03:54,48.116313,11.577769,"church, architecture, no person, cathedral, indoors, religion, building, travel, arch, city",1.9422,1.9298,miserable
24629290357_e6e2e53df5_b.jpg,2017:12:29,16:38:03,48.143918,11.637353,"winter, snow, tree, cold, water, landscape, lake, weather, nature, ice",2.1241,1.7565,contented
27654828159_896eff80a6_b.jpg,2017:12:29,15:39:43,48.158896,11.506840,"water, people, no person, bird, outdoors, winter, travel, lake, landscape, group",2.2042,2.0812,happy
27654841699_7d9b76d67f_b.jpg,2017:12:30,12:59:23,48.136906,11.576525,"city, architecture, travel, tourism, building, tourist, street, people, town, outdoors",2.1226,2.0046,happy
38652487184_b0b39dcb1d_b.jpg,2017:12:18,19:32:27,48.143425,11.576216,"people, group, many, crowd, rally, religion, rebellion, battle, administration, police",1.7871,2.1875,upset
24472804727_b69d0509aa_b.jpg,2017:06:26,22:52:39,48.170393,11.556211,"sunset, city, sky, evening, storm, landscape, light, dusk, skyline, dawn",2.1441,1.7181,serene
27768731829_b4f79e9655_b.jpg,2017:11:23,15:51:36,48.103669,11.552681,"bird, duck, goose, pool, wildlife, water, lake, waterfowl, poultry, nature",2.3321,1.8111,contented
38650710325_fce3a86cb4_b.jpg,2017:12:28,12:14:07,48.137272,11.575061,"people, street, man, portrait, city, adult, urban, woman, one, religion",2.0352,1.8305,contented
38682464174_9824f8cdf8_b.jpg,2017:07:11,13:55:03,48.093055,11.570277,"tree, wood, landscape, no person, nature, house, outdoors, travel, garden, flora",2.2462,1.7279,serene
38693952184_d6178f0593_b.jpg,2017:01:25,13:28:40,48.127705,11.581938,"people, no person, cave, exploration, one, travel, man, adult, outdoors, subway system",2.2373,2.2658,elated
39353166571_cc0a740651_b.jpg,2017:12:24,17:04:37,48.116088,11.577805,"church, cathedral, religion, communion table, architecture, goth like, chapel, indoors, bench, cross",1.7968,1.4869,depressed
24465495457_f66f5c4b32_b.jpg,2017:12:26,11:11:06,48.177699,11.556677,"business, modern, glass items, office, architecture, steel, urban, building, skyscraper, city",1.7151,1.7763,miserable
27698215779_a814805ed3_b.jpg,2017:12:14,17:28:26,48.138161,11.571691,"light, city, travel, street, building, evening, road, architecture, no person, urban",1.9958,1.7454,sad
39375330522_206ffb4c64_b.jpg,2017:12:26,17:06:58,48.171537,11.529142,"blur, transportation system, subway system, light, street, road, no person, travel, tunnel, traffic",1.934,2.0321,upset
39552443752_2c75827a8b_b.jpg,2018:01:08,20:32:04,48.128333,11.578055,"no person, travel, water, business, tunnel, desktop, architecture, illustration, outdoors, light",2.019,1.9079,contented
25469625008_16b65facc5_b.jpg,2017:12:27,15:41:34,48.133473,11.573817,"retro, illustration, people, art, man, paper, vintage, wear, desktop, bill",1.9586,1.821,miserable
27613761069_3817205a6d_b.jpg,2017:07:11,14:36:04,48.086666,11.604166,"grass, tree, no person, lawn, wood, landscape, outdoors, garden, bench, summer",2.1063,1.4414,relaxed
39513320432_0cec226247_b.jpg,2018:01:06,12:47:26,48.158294,11.507038,"water, travel, no person, architecture, sky, summer, sea, outdoors, building, sunset",2.4922,1.9216,contented
38687024794_488371d2bf_b.jpg,2017:11:02,13:52:12,48.159673,11.585895,"food, no person, delicious, dinner, lunch, plate, fork, homemade, knife, meal",1.9912,1.5287,sad
39359224252_eee18436cb_b.jpg,2017:12:16,11:06:34,48.136427,11.575516,"city, architecture, cityscape, travel, roof, skyline, town, panorama, no person, urban",2.0952,1.9889,contented
39475559961_ea73e8a9fe_b.jpg,2017:12:14,17:37:18,48.137319,11.575477,"people, architecture, city, travel, administration, evening, street, outdoors, parliament, illuminated",1.9961,1.858,miserable
24559977567_40e7fbc0b9_b.jpg,2017:12:25,16:00:09,48.136722,11.575619,"city, architecture, no person, travel, cityscape, skyline, building, sunset, church, roof",2.1442,2.0298,happy
24712436147_116e82ac53_b.jpg,2018:01:08,18:28:12,48.136107,11.690504,"water, architecture, city, building, travel, no person, river, pier, sky, urban",2.2286,1.9362,contented
38663961924_8e038c4e6e_b.jpg,2017:12:29,15:32:02,48.136759,11.576875,"architecture, city, church, building, religion, travel, cathedral, no person, tower, town",2.014,1.8993,contented
39330567072_9e3cbd35cb_b.jpg,2017:12:24,14:43:13,48.122988,11.567499,"water, no person, architecture, travel, river, sky, castle, landscape, outdoors, tree",2.3864,1.8528,contented
24675241927_be4ed810b1_b.jpg,2018:01:06,13:22:02,48.156844,11.504730,"water, no person, reflection, architecture, lake, building, house, outdoors, river, sky",2.1893,1.7012,serene
25672419678_12e8a310e6_b.jpg,2018:01:06,12:51:25,48.157605,11.505716,"architecture, travel, no person, water, outdoors, sky, ancient, old, castle, building",2.1394,1.8073,contented
25672722018_652dc34675_b.jpg,2018:01:04,17:11:07,48.137296,11.575233,"city, travel, architecture, people, street, tourist, outdoors, tourism, building, town",2.1226,2.0046,happy
27593611949_5f7a6cd6de_b.jpg,2017:12:21,20:11:18,48.140533,11.567658,"no person, step, architecture, technology, steel, spiral, old, industry, iron, indoors",1.7446,1.679,sad
38645647524_1cf27b3ebb_b.jpg,2017:12:24,16:46:42,48.115463,11.578216,"architecture, church, no person, religion, cathedral, travel, building, tower, city, sky",2.1181,1.8993,contented
39353162061_ea3a1bb047_b.jpg,2017:12:24,17:08:08,48.116300,11.576855,"no person, interior design, indoors, church, architecture, communion table, candle, religion, travel, cathedral",2.1034,1.7036,serene
39431776501_510f872006_b.jpg,2017:12:31,11:37:38,48.247505,11.563343,"tree, fall, wood, road, landscape, guidance, park, nature, no person, leaf",2.2303,1.6979,serene
39503196002_3a07719052_b.jpg,2017:12:31,15:37:35,48.172990,11.554988,"no person, architecture, tower, sky, outdoors, travel, city, building, technology, water",2.1858,1.9094,contented
25569242168_d73eebcda3_b.jpg,2017:12:02,16:45:38,48.142669,11.573208,"city, street, architecture, building, no person, light, travel, people, evening, town",2.0682,1.8535,contented
27576885129_308270cb76_b.jpg,2017:12:24,15:31:11,48.135352,11.588080,"tree, water, fall, river, lake, no person, architecture, landscape, building, sky",2.159,1.7675,contented
39438719431_cc4141d281_b.jpg,2017:12:01,19:59:06,48.138677,11.567647,"Christmas, winter, snow, christmas tree, celebration, people, tree, New Year, no person, decoration",2.5254,2.1395,happy
39581775801_7715ce50f0_b.jpg,2018:01:08,20:35:02,48.128055,11.581388,"tunnel, subway system, light, dark, indoors, perspective, travel, wall, inside, blur",1.8781,1.7813,miserable
39066280864_57e03e98cf_b.jpg,2018:01:19,01:57:53,48.138642,11.573613,"no person, travel, architecture, outdoors, city, snow, building, mountain, sky, landscape",2.1869,1.8205,contented
39290074174_6e5c14c026_b.jpg,2018:01:26,16:01:20,48.107811,11.657438,"house, architecture, no person, family, wood, door, building, window, modern, street",2.0116,1.5865,serene
25044031467_78287cb72a_b.jpg,2018:01:26,18:12:53,48.136597,11.575588,"architecture, art, travel, building, indoors, decoration, museum, church, gold, religion",2.0706,1.9063,contented
28153846209_0608ce88e8_b.jpg,2018:01:26,00:30:09,48.139541,11.546986,"street, road, city, travel, car, light, traffic, transportation system, evening, illuminated",2.0368,1.867,contented
40016827571_a7e69f9798_b.jpg,2017:08:27,14:57:46,48.163252,11.500430,"nature, flora, leaf, flower, garden, floral, desktop, closeup, color, summer",2.3812,1.5589,serene
24726393457_0fc9d1eb83_b.jpg,2018:01:05,09:52:13,48.110058,11.582819,"no person, architecture, outdoors, building, city, house, daylight, home, sky, apartment",2.2327,1.7397,serene
25044010797_de77ba19df_b.jpg,2018:01:26,18:20:15,48.137338,11.574763,"architecture, building, city, travel, religion, outdoors, church, tourism, street, tower",1.9931,1.8493,miserable
26042905198_10b5cfcfe3_b.jpg,2018:01:26,22:08:37,48.136430,11.575677,"people, building, city, many, group, religion, architecture, travel, tourism, tourist",2.0905,2.0782,happy
25037358347_276a1b8d10_b.jpg,2018:01:26,13:40:39,48.101394,11.631002,"vehicle, car, no person, truck, transportation system, bus, travel, traffic, road, outdoors",2.0512,2.2361,happy
28015564049_71b4f97722_b.jpg,2018:01:20,11:49:50,48.129871,11.546920,"winter, snow, fog, nature, weather, landscape, no person, outdoors, storm, tree",2.0748,1.7598,contented
39736366422_1666b256f6_b.jpg,2018:01:18,22:39:18,48.156295,11.528874,"window, glass items, architecture, modern, no person, reflection, desktop, indoors, design, building",1.9129,1.7001,sad
39783854651_1ae08297a2_b.jpg,2018:01:19,15:29:31,48.178888,11.375000,"landscape, tree, dawn, fog, nature, winter, fall, sunset, wood, light",2.1226,1.6749,serene
39016651845_e9f8fb9b2c_b.jpg,2018:01:26,16:14:22,48.112872,11.575819,"coffee, no person, food, wood, breakfast, indoors, knife, tea, dawn, drink",2.1656,1.6165,serene
39944477402_8337637206_b.jpg,2018:01:30,00:26:03,48.132270,11.548132,"people, carnival, festival, fun, city, music, enjoyment, recreation, man, group",2.4157,2.1858,happy
28135738839_040e66f91a_b.jpg,2018:01:26,22:12:33,48.136630,11.575611,"no person, travel, city, architecture, town, building, cityscape, outdoors, roof, church",2.066,1.9726,contented
39764304522_934027a880_b.jpg,2018:01:15,22:14:39,48.177830,11.593730,"business, people, indoors, man, adult, woman, technology, office, computer, commerce",1.9473,1.8475,miserable
39883574502_24326f727b_b.jpg,2018:01:25,16:48:48,48.140161,11.558538,"transportation system, train, railway, car, bus, subway system, traffic, vehicle, blur, locomotive",1.9769,2.1497,upset
